{
  "schema_name": "TrendsSnapshot",
  "schema_version": "1.0.0",
  "id": "01JH7Y0R5KX6K0A1YV7A3XQH8C",
  "ts": "2025-12-12T20:15:09.000Z",
  "room_id": "room:demo",
  "window_s": 30,
  "msg_per_s": 3.2,
  "top_tokens": [{ "token": "Pog", "count": 6 }],
  "top_mentions": [{ "token": "someViewer", "count": 2 }],
  "bot_fraction": 0.25,
  "meta": { "note": "meta is optional and free-form" }
}
