{
  "schema_name": "TrendsSnapshot",
  "schema_version": "1.0.0",
  "id": "01JH7Y0R5KX6K0A1YV7A3XQH8A",
  "ts": "2025-12-12T20:15:07.000Z",
  "room_id": "room:demo",
  "window_s": 15,
  "msg_per_s": 7.4,
  "top_tokens": [
    { "token": "KEKW", "count": 32 },
    { "token": "LEFT", "count": 21 }
  ],
  "top_mentions": [
    { "token": "ClipGoblin", "count": 9 }
  ],
  "bot_fraction": 0.62,
  "meta": { "source": "gateway_trends" }
}
